[
  {
    "id": "follow_001",
    "follower_id": "demo_user",
    "following_id": "user_jiangfeng",
    "created_at": "2026-06-10T08:00:00+00:00"
  },
  {
    "id": "follow_1781378274551",
    "follower_id": "demo_user",
    "following_id": "user_aming",
    "created_at": "2026-06-13T19:17:54.551051+00:00"
  }
]